{
  "schemaVersion": 1,
  "decision": "WORKFLOW_INVENTORY_IS_CONTEXT_ROUTED_READ_ONLY_AND_EXACT_SHA",
  "coreWorkflows": [
    "ci-backends.yml",
    "ci-node-diagnostics.yml",
    "ci-node-verification.yml",
    "ci-policy.yml",
    "ci-runtime.yml",
    "ci.yml",
    "dsh-database.yml",
    "lockfile-integrity.yml",
    "manual-deep-verification.yml"
  ],
  "privilegedWorkflow": null,
  "requiredChecks": [
    {"context":"BThwani CI result","producer":"github-actions","purpose":"Fail-closed aggregate result for contextual CI."},
    {"context":"SonarQube Cloud scan","producer":"github-actions","purpose":"Repository-driven SonarQube Cloud scan execution."},
    {"context":"SonarCloud Code Analysis","producer":"sonarqubecloud","purpose":"SonarQube Cloud Quality Gate result."},
    {"context":"CodeQL result","producer":"github-actions","purpose":"Fail-closed aggregate for affected-scope CodeQL analysis; protected-branch pushes and scheduled runs remain full scans."},
    {"context":"Dependency review","producer":"github-actions","purpose":"Blocks newly introduced dependencies with known vulnerabilities."}
  ],
  "entries": [
    {"id":"ci","path":".github/workflows/ci.yml","class":"CORE","name":"BThwani Contextual CI","triggers":["workflow_dispatch","pull_request","push"],"permissions":{"contents":"read"},"mayMutateSource":false,"mayUseSecrets":false,"requiredPinnedActions":true,"purpose":"Root exact-SHA orchestrator that calculates affected and risk-expanded scope, invokes reusable verification engines, and enforces one fail-closed result."},
    {"id":"ci-policy","path":".github/workflows/ci-policy.yml","class":"CORE","name":"BThwani Policy Verification","triggers":["workflow_call"],"permissions":{"contents":"read"},"mayMutateSource":false,"mayUseSecrets":false,"requiredPinnedActions":true,"purpose":"Reusable repository, governance, workflow, security, nomenclature, and infrastructure policy verification engine."},
    {"id":"ci-node-diagnostics","path":".github/workflows/ci-node-diagnostics.yml","class":"CORE","name":"BThwani Node Diagnostics","triggers":["workflow_call"],"permissions":{"contents":"read"},"mayMutateSource":false,"mayUseSecrets":false,"requiredPinnedActions":true,"purpose":"Reusable affected static diagnostics for boundaries, bindings, accessibility, dependency direction, dead code, duplication, and repository integrity."},
    {"id":"ci-node-verification","path":".github/workflows/ci-node-verification.yml","class":"CORE","name":"BThwani Node Verification","triggers":["workflow_call"],"permissions":{"contents":"read"},"mayMutateSource":false,"mayUseSecrets":false,"requiredPinnedActions":true,"purpose":"Reusable affected or full typecheck, lint, test, build, contract, and governed capability verification engine."},
    {"id":"ci-backends","path":".github/workflows/ci-backends.yml","class":"CORE","name":"BThwani Backend Verification","triggers":["workflow_call"],"permissions":{"contents":"read"},"mayMutateSource":false,"mayUseSecrets":false,"requiredPinnedActions":true,"purpose":"Reusable affected Go backend and isolated PostgreSQL migration, test, vet, and build verification engine."},
    {"id":"ci-runtime","path":".github/workflows/ci-runtime.yml","class":"CORE","name":"BThwani Runtime Proof","triggers":["workflow_call"],"permissions":{"contents":"read"},"mayMutateSource":false,"mayUseSecrets":false,"requiredPinnedActions":true,"purpose":"Reusable runtime startup, bootstrap, readiness, smoke, and teardown proof when the router or explicit request requires runtime evidence."},
    {"id":"dsh-database","path":".github/workflows/dsh-database.yml","class":"CORE","name":"DSH Database Contract","triggers":["push","pull_request","workflow_dispatch"],"permissions":{"contents":"read"},"mayMutateSource":false,"mayUseSecrets":false,"requiredPinnedActions":true,"purpose":"Verifies the canonical DSH database migrations, schema, seeds, and contract against an isolated PostgreSQL service."},
    {"id":"lockfile-integrity","path":".github/workflows/lockfile-integrity.yml","class":"CORE","name":"BThwani Lockfile Integrity","triggers":["pull_request"],"permissions":{"contents":"read"},"mayMutateSource":false,"mayUseSecrets":false,"requiredPinnedActions":true,"purpose":"Read-only frozen-lockfile verification for dependency manifest changes; it never generates or uploads a replacement tracked lockfile."},
    {"id":"manual-deep-verification","path":".github/workflows/manual-deep-verification.yml","class":"CORE","name":"BThwani Manual Deep Verification","triggers":["workflow_dispatch"],"permissions":{"contents":"read"},"mayMutateSource":false,"mayUseSecrets":false,"requiredPinnedActions":true,"purpose":"Read-only exact-SHA affected and risk-expanded manual verification with optional full runtime proof and a machine-readable decision artifact."},
    {"id":"codeql","path":".github/workflows/codeql.yml","class":"SECURITY_SCANNER","name":"CodeQL","triggers":["pull_request","push","schedule"],"permissions":{"contents":"read","security-events":"write"},"mayMutateSource":false,"mayUseSecrets":false,"requiredPinnedActions":true,"purpose":"Context-routed static application and workflow security testing for GitHub Actions, javascript-typescript, and affected Go backend modules, using security-extended queries. Workflow changes and protected-branch or scheduled runs remain full scans; the fail-closed CodeQL result aggregate is the merge context."},
    {"id":"dependency-review","path":".github/workflows/dependency-review.yml","class":"SECURITY_SCANNER","name":"Dependency Review","triggers":["pull_request","push"],"permissions":{"contents":"read"},"mayMutateSource":false,"mayUseSecrets":false,"requiredPinnedActions":true,"purpose":"Fail-closed pull-request supply-chain gate that blocks introduction of known vulnerable dependencies at LOW severity or higher and exposes a deterministic protected-branch check context."},
    {"id":"sonarqube","path":".github/workflows/sonarqube.yml","class":"SECURITY_SCANNER","name":"SonarQube","triggers":["pull_request","push"],"permissions":{"contents":"read"},"mayMutateSource":false,"mayUseSecrets":true,"requiredPinnedActions":true,"purpose":"Code quality and security analysis published to SonarQube Cloud; pull requests generate Go coverage only for affected modules while protected master pushes retain the full Go coverage baseline.","secretsJustification":"SonarQube authenticates uploads with SONAR_TOKEN; the scanner cannot publish without it. The token is scoped to the SonarQube Cloud scanner and grants no repository write access."}
  ]
}
